{
  "$schema": "http://json-schema.org/draft-07/schema#",
  "$id": "https://databricks-solutions.github.io/consort/schemas/deploy-evidence.schema.json",
  "title": "DeployEvidence",
  "description": "The Release Engineer's deploy-gate evidence for a FEATURE, persisted as features/<F>/deploy-evidence.json by lakebase-sftdd-deploy. It records that the increment was deployed to a target, is reachable, and passed its feature-verify run against the RUNNING app. The deploy gate approves only when this artifact exists, is conformant, and records reachable=true AND verify.passed=true (the working-software teeth).",
  "type": "object",
  "required": ["schema_version", "feature_id", "target", "url", "reachable", "verify", "deployed_at"],
  "properties": {
    "schema_version": {
      "type": "integer",
      "minimum": 1
    },
    "feature_id": {
      "type": "string",
      "pattern": "^F[0-9]+(-[a-z0-9-]+)?$"
    },
    "target": {
      "type": "string",
      "minLength": 1,
      "description": "The deploy target name (e.g. local) from deploy-targets.yaml."
    },
    "url": {
      "type": "string",
      "minLength": 1,
      "description": "The reachable URL the app answered on (base_url + health_path)."
    },
    "reachable": {
      "type": "boolean",
      "description": "True when the app answered ANY HTTP response within the ready timeout."
    },
    "verify": {
      "type": "object",
      "required": ["passed"],
      "properties": {
        "passed": {
          "type": "boolean",
          "description": "True when the feature-verify command exited 0 against the running app."
        },
        "command": {
          "type": "string",
          "description": "The feature-verify command that was run (from the target's verify field)."
        },
        "summary": {
          "type": "string",
          "description": "Short human-readable summary of the verify outcome."
        }
      },
      "additionalProperties": false
    },
    "lakebase_branch": {
      "type": "string",
      "description": "The Lakebase branch the deployed app ran against (a per-story experiment branch, or unset for the feature-branch per-sprint deploy)."
    },
    "deployed_at": {
      "type": "string",
      "description": "ISO-8601 timestamp the evidence was recorded."
    }
  },
  "additionalProperties": false
}
