{
  "schema_version": 1,
  "feature_id": "F6-split-tracking-code",
  "target": "local",
  "url": "http://localhost:8000/",
  "reachable": true,
  "verify": {
    "passed": true,
    "command": "./scripts/run-tests.sh",
    "summary": "feature-verify passed against the running app"
  },
  "lakebase_branch": "feature-f6-split-tracking-code",
  "deployed_at": "2026-08-01T08:31:59.263Z"
}
